{
  "$schema": "cbse-class10-mathematics-2026-27-baseline.schema.json",
  "baseline_version": "1.0.0",
  "board": "CBSE",
  "class": "10",
  "academic_year": "2026-27",
  "subject": "Mathematics",
  "subject_codes": [
    "041",
    "241"
  ],
  "subject_code_note": "Mathematics Standard (041) and Mathematics Basic (241) share the candidate content baseline. This package makes no claim that the two codes receive identical assessment treatment; question-paper design and difficulty differ and require human subject-expert confirmation.",
  "status": "INDEPENDENT_BASELINE_UNVERIFIED_BY_HUMAN_EXPERT",
  "source_records": [
    {
      "source_id": "SRC_CBSE_MATH_2627",
      "authority": "CBSE Academic",
      "title": "Secondary School Curriculum 2026-27: Main Subjects (Mathematics - Subject Codes 041/241)",
      "source_type": "OFFICIAL_SYLLABUS",
      "subject": "Mathematics",
      "subject_codes": [
        "041",
        "241"
      ],
      "academic_year": "2026-27",
      "official_url": "https://cbseacademic.nic.in/web_material/CurriculumMain27/SecPart1/Maths_SecP1X_2026-27.pdf",
      "notes": "Source record materialised during packaging because the candidate file referenced this source id without defining it. Official-domain URL identity only: the document was not retrieved, no checksum was computed and session applicability is unconfirmed.",
      "publication_date": null,
      "document_version": null,
      "retrieval_timestamp": null,
      "applicability_status": "PENDING_CONFIRMATION",
      "finality_status": "PENDING_CONFIRMATION",
      "checksum_status": "CHECKSUM_NOT_COMPUTED",
      "sha256": null
    }
  ],
  "total_units": 7,
  "total_chapters": 14,
  "total_requirements": 38,
  "requirements": [
    {
      "requirement_id": "REQ_MATH_2026_001",
      "sequence": 1,
      "official_unit": "Unit I: Number Systems",
      "official_chapter": "Real Numbers",
      "official_topic": "Fundamental Theorem of Arithmetic",
      "official_requirement": "Fundamental Theorem of Arithmetic - statements after reviewing work done earlier and after illustrating and motivating through examples.",
      "requirement_type": "CONCEPTUAL_UNDERSTANDING",
      "assessability": "ASSESSABLE_CORE",
      "official_source_id": "SRC_CBSE_MATH_2627",
      "source_reference": "Maths_SecP1X_2026-27.pdf Page 2",
      "auditor_derived": false,
      "ambiguity_status": "CLEAR",
      "review_note": "Core concept.",
      "status": "ACTIVE_BASELINE_REQUIREMENT"
    },
    {
      "requirement_id": "REQ_MATH_2026_002",
      "sequence": 2,
      "official_unit": "Unit I: Number Systems",
      "official_chapter": "Real Numbers",
      "official_topic": "Prime Factorization Applications",
      "official_requirement": "Finding HCF and LCM of given pairs using prime factorization.",
      "requirement_type": "CALCULATION",
      "assessability": "ASSESSABLE_CORE",
      "official_source_id": "SRC_CBSE_MATH_2627",
      "source_reference": "Maths_SecP1X_2026-27.pdf Page 2",
      "auditor_derived": false,
      "ambiguity_status": "CLEAR",
      "review_note": "Calculation procedure.",
      "status": "ACTIVE_BASELINE_REQUIREMENT"
    },
    {
      "requirement_id": "REQ_MATH_2026_003",
      "sequence": 3,
      "official_unit": "Unit I: Number Systems",
      "official_chapter": "Real Numbers",
      "official_topic": "Irrationality Proofs",
      "official_requirement": "Proofs of irrationality of root 2, root 3, root 5.",
      "requirement_type": "PROOF_OR_JUSTIFICATION",
      "assessability": "ASSESSABLE_CORE",
      "official_source_id": "SRC_CBSE_MATH_2627",
      "source_reference": "Maths_SecP1X_2026-27.pdf Page 2",
      "auditor_derived": false,
      "ambiguity_status": "CLEAR",
      "review_note": "Mandatory proof.",
      "status": "ACTIVE_BASELINE_REQUIREMENT"
    },
    {
      "requirement_id": "REQ_MATH_2026_004",
      "sequence": 4,
      "official_unit": "Unit I: Number Systems",
      "official_chapter": "Real Numbers",
      "official_topic": "Contextual Applications",
      "official_requirement": "Application of prime factorization in real-world contextual problems.",
      "requirement_type": "APPLICATION",
      "assessability": "ASSESSABLE_CORE",
      "official_source_id": "SRC_CBSE_MATH_2627",
      "source_reference": "Maths_SecP1X_2026-27.pdf Page 2",
      "auditor_derived": true,
      "ambiguity_status": "CLEAR",
      "review_note": "Auditor-derived application requirement.",
      "status": "ACTIVE_BASELINE_REQUIREMENT"
    },
    {
      "requirement_id": "REQ_MATH_2026_005",
      "sequence": 5,
      "official_unit": "Unit II: Algebra",
      "official_chapter": "Polynomials",
      "official_topic": "Zeros of Polynomials",
      "official_requirement": "Zeros of a polynomial.",
      "requirement_type": "CONCEPTUAL_UNDERSTANDING",
      "assessability": "ASSESSABLE_CORE",
      "official_source_id": "SRC_CBSE_MATH_2627",
      "source_reference": "Maths_SecP1X_2026-27.pdf Page 2",
      "auditor_derived": false,
      "ambiguity_status": "CLEAR",
      "review_note": "Core concept.",
      "status": "ACTIVE_BASELINE_REQUIREMENT"
    },
    {
      "requirement_id": "REQ_MATH_2026_006",
      "sequence": 6,
      "official_unit": "Unit II: Algebra",
      "official_chapter": "Polynomials",
      "official_topic": "Zeros and Coefficients Relationship",
      "official_requirement": "Relationship between zeros and coefficients of quadratic polynomials.",
      "requirement_type": "CALCULATION",
      "assessability": "ASSESSABLE_CORE",
      "official_source_id": "SRC_CBSE_MATH_2627",
      "source_reference": "Maths_SecP1X_2026-27.pdf Page 2",
      "auditor_derived": false,
      "ambiguity_status": "CLEAR",
      "review_note": "Algebraic verification.",
      "status": "ACTIVE_BASELINE_REQUIREMENT"
    },
    {
      "requirement_id": "REQ_MATH_2026_007",
      "sequence": 7,
      "official_unit": "Unit II: Algebra",
      "official_chapter": "Polynomials",
      "official_topic": "Geometric Meaning of Zeros",
      "official_requirement": "Geometric meaning of zeros of a quadratic polynomial.",
      "requirement_type": "VISUALISATION",
      "assessability": "ASSESSABLE_CORE",
      "official_source_id": "SRC_CBSE_MATH_2627",
      "source_reference": "Maths_SecP1X_2026-27.pdf Page 2",
      "auditor_derived": false,
      "ambiguity_status": "CLEAR",
      "review_note": "Graphical analysis.",
      "status": "ACTIVE_BASELINE_REQUIREMENT"
    },
    {
      "requirement_id": "REQ_MATH_2026_008",
      "sequence": 8,
      "official_unit": "Unit II: Algebra",
      "official_chapter": "Pair of Linear Equations in Two Variables",
      "official_topic": "Graphical Solution and Consistency",
      "official_requirement": "Pair of linear equations in two variables and graphical method of their solution, consistency/inconsistency.",
      "requirement_type": "VISUALISATION",
      "assessability": "ASSESSABLE_CORE",
      "official_source_id": "SRC_CBSE_MATH_2627",
      "source_reference": "Maths_SecP1X_2026-27.pdf Page 2",
      "auditor_derived": false,
      "ambiguity_status": "CLEAR",
      "review_note": "Graphical representation.",
      "status": "ACTIVE_BASELINE_REQUIREMENT"
    },
    {
      "requirement_id": "REQ_MATH_2026_009",
      "sequence": 9,
      "official_unit": "Unit II: Algebra",
      "official_chapter": "Pair of Linear Equations in Two Variables",
      "official_topic": "Algebraic Conditions for Solutions",
      "official_requirement": "Algebraic conditions for number of solutions (unique, infinitely many, no solution).",
      "requirement_type": "CONCEPTUAL_UNDERSTANDING",
      "assessability": "ASSESSABLE_CORE",
      "official_source_id": "SRC_CBSE_MATH_2627",
      "source_reference": "Maths_SecP1X_2026-27.pdf Page 2",
      "auditor_derived": false,
      "ambiguity_status": "CLEAR",
      "review_note": "Condition checking.",
      "status": "ACTIVE_BASELINE_REQUIREMENT"
    },
    {
      "requirement_id": "REQ_MATH_2026_010",
      "sequence": 10,
      "official_unit": "Unit II: Algebra",
      "official_chapter": "Pair of Linear Equations in Two Variables",
      "official_topic": "Substitution Method",
      "official_requirement": "Algebraic solution of a pair of linear equations by substitution method.",
      "requirement_type": "CALCULATION",
      "assessability": "ASSESSABLE_CORE",
      "official_source_id": "SRC_CBSE_MATH_2627",
      "source_reference": "Maths_SecP1X_2026-27.pdf Page 2",
      "auditor_derived": false,
      "ambiguity_status": "CLEAR",
      "review_note": "Algebraic computation.",
      "status": "ACTIVE_BASELINE_REQUIREMENT"
    },
    {
      "requirement_id": "REQ_MATH_2026_011",
      "sequence": 11,
      "official_unit": "Unit II: Algebra",
      "official_chapter": "Pair of Linear Equations in Two Variables",
      "official_topic": "Elimination Method",
      "official_requirement": "Algebraic solution of a pair of linear equations by elimination method.",
      "requirement_type": "CALCULATION",
      "assessability": "ASSESSABLE_CORE",
      "official_source_id": "SRC_CBSE_MATH_2627",
      "source_reference": "Maths_SecP1X_2026-27.pdf Page 2",
      "auditor_derived": false,
      "ambiguity_status": "CLEAR",
      "review_note": "Algebraic computation.",
      "status": "ACTIVE_BASELINE_REQUIREMENT"
    },
    {
      "requirement_id": "REQ_MATH_2026_012",
      "sequence": 12,
      "official_unit": "Unit II: Algebra",
      "official_chapter": "Pair of Linear Equations in Two Variables",
      "official_topic": "Situational Word Problems",
      "official_requirement": "Simple situational and contextual word problems solvable by linear equations.",
      "requirement_type": "PROBLEM_SOLVING",
      "assessability": "ASSESSABLE_CORE",
      "official_source_id": "SRC_CBSE_MATH_2627",
      "source_reference": "Maths_SecP1X_2026-27.pdf Page 2",
      "auditor_derived": false,